id,headline,subheading,body
uk-politics-17936005,MPs' pay: Public asked for views in Ipsa consultation,The body in charge of setting MPs' salaries and pensions has launched a public consultation on whether MPs are giving taxpayers value for money.,"The Independent Parliamentary Standards Authority (Ipsa) chair, Sir Ian Kennedy, said he would not be guided by ""political insiders"" in Westminster. This will be the first time pay and pensions are decided independently of Parliament or government. ""This is a huge change from the past,"" Sir Ian said. On the Ipsa website, he asks: ""How much should MPs be paid? ""I'm sure you have a view. We want to hear it."" Ipsa had dealt with the ""mess created by the expenses scandal"", Sir Ian said, with MPs' claims now documented online and rules adhered to. Deciding on MPs' pay and pensions was Ipsa's ""next big challenge"". Democratic heritage The body is hoping to reach a consensus on the experience and skills needed to be an MP, and what MPs' responsibilities are at work. This could help compare MPs' pay with that of similar roles. But it would not be easy, Sir Ian warned, since MPs argued that they all did their jobs differently and being an MP was a ""unique"" profession. Ipsa has decided ""to get as many views as possible"" before reaching any conclusions. ""Of course, the views must be informed rather than a reaction to recent events,"" Sir Ian said. ""We are talking about something very important here: part of the fabric which makes up our democratic heritage. How we remunerate MPs is a statement about the place they have in our society. ""So, we have to move carefully and thoughtfully."""
uk-scotland-47855150,New medicines approved for Scottish NHS,"New medicines for treating migraines, psoriasis and liver cancer have been approved for use by NHS Scotland.","The three drugs have been licensed by the Scottish Medicines Consortium for use in the Scottish health service. They include Erenumab, for chronic migraines, Lenvatinib, for liver cancer patients, and Certolizumab, for moderate to severe psoriasis. SMC chairman Dr Alan MacDonald said the committee hoped the moves would be welcomed by patients. Patients suffering from chronic migraines who have seen at least three other preventative medicines fail will now be able to take Erenumab, also known as Amiovig, after it was found to reduce the duration of symptoms such as extreme head pain and nausea. Liver cancer patients with hepatocellular carcinoma - a type of cancer often diagnosed at a late stage, giving patients a poor prognosis - will be able to access Lenvatinib (or Lenvima) if they are not able to undergo surgery or have a transplant. And Certolizumab (or Cimzia) offers another treatment option for adult patients with moderate to severe plaque psoriasis, which has not responded to standard therapies."
world-europe-12249452,German reality TV star Cora dies after sixth breast op,"German tabloids have been mourning reality TV star Carolin ""Sexy Cora"" Berger, who died in a coma after her sixth breast operation, aged 23.","Ms Berger, a sex film celebrity, had joined the German version of Big Brother last year, where she behaved more and more outrageously. She embarked on a series of breast enlargements in a bid to keep her publicity going. Hamburg prosecutors are investigating her doctors for negligence. Ms Berger was put in an artificial coma on 11 January because of serious complications after her sixth operation, which took place at a clinic in the north German city. It is believed she suffered two cardiac arrests after the procedure to enlarge her breasts from a 70F to a 70G (UK: 34F to 34G). She had wanted to increase the size of her silicone breast enhancements from 500g (18oz) to 800g (28oz) each, Bild newspaper reported. 'Senseless death' ""The senseless death of Big Brother star Cora shocks the whole of Germany,"" Bild said. ""[Her] frail, 48kg (106lb) body struggled against death for 224 hours. She lost. Cora is dead!"" Hamburg tabloid Morgenpost, which had a special section called simply ""Cora"", said Ms Berger had recently come back from a cruise to Dubai with her husband. Just before the operation, the Berlin-born TV star tweeted her fans a cute photo of her dog sleeping in a laundry basket, it added. Prosecutors in Hamburg announced they were investigating the anaesthesiologist and the surgeon who performed the operation at the Alster plastic surgery clinic, on suspicion of negligent homicide. They said a post-mortem would be performed on Ms Berger."
uk-england-devon-18867654,KEVICC uniform protest detentions: Parents slam 'spiteful' crackdown,Parents at a school in Devon have expressed shock that their children are being punished for protesting against the reintroduction of a school uniform.,"King Edward VI Community College, in Totnes, abolished its uniform in 2003 but said it would return in September. Some students have been disciplined with ""internal exclusion"" for staging protests against the decision. Parent Mik Wells said the punishment was ""unfair and spiteful"". The school said the protests were ""truancy"". Principal Kate Mason announced the school would reintroduce a uniform in September following a report which suggested the school was perceived as ""scruffy"". She said the school hosted a consultation and the ""responses clearly favoured"" a uniform. 'Culture of fear' Pupils opposed to the changes staged protests - including waving banners and walking out of lessons - on 2, 3 and 4 July. But Mr Wells, whose 14-year-old daughter has been put into internal isolation for two days, said he was was ""shocked"" by the punishment. Chris Mockridge, whose daughter also goes to the school, said: ""This isn't all about uniform, there's people who really want the uniform who are really angry also. ""The communication within the school has completely broken down. ""They won't talk to me and they won't talk to anyone else - that's not a culture of openness, that's a culture of fear."" Police involvement Mr Mockridge said the exclusions were taking place during Activities Week. ""Parents have paid for these activities, the dearest of these is £250, and the kids are not going to go on those activities, so who's going to pay for them? No-one's talking."" On its website, the school said the protest had led to ""misbehaviour"". It said: ""The behaviour was disruptive but contained by staff on site and then by the police on the bridge. ""There was, however, a small number of students who chose to protest... such truancy cannot continue."" A police spokesman said no-one was arrested during the protest. The local education authority, Devon County Council, said it was a matter to be dealt with by school governors. The 450-year-old school, also known as KEVICC, includes a sixth form and a performing arts college. It recently got a ""satisfactory"" rating from Ofsted."
10550867,Glee challenges 30 Rock Emmy run,Hit musical comedy Glee is in pole position to end 30 Rock's three-year run as best comedy in the nominations for the US TV Emmy Awards.,"Glee, which has 19 nominations in total, and 30 Rock go up against Curb Your Enthusiasm, Modern Family, Nurse Jackie and The Office. HBO's World War II mini-series The Pacific, co-produced by Steven Spielberg, leads the way with 24 nods. The 62nd Emmy Awards will take place on 29 August in Los Angeles. Glee, which is broadcast on E4 and Channel 4 in the UK, also received best comedy actor nominations for Matthew Morrison, who plays teacher Will Schuester, and Lea Michele - Rachel Berry in the series. Glee's Morrison goes up against actors including previous winner Steve Carell of The Office - with his fifth nomination in a row - and Curb Your Enthusiasm' s Larry David. In the best comedy category, Glee and 30 Rock face competition from new show Modern Family, which is made in the style of a mock documentary focusing on the lives of one extended family. Meanwhile, former ER star Julianna Margulies is nominated for best actress in a drama for her role as the wife of a disgraced public official in The Good Wife. The Pacific, narrated by Tom Hanks - who is also an executive producer - is nominated in categories including best mini-series. The show, which tells the story of three Marines fighting America's battle with the Japanese in the Pacific, goes up against the BBC's Return To Cranford, starring Dame Judi Dench. Dame Judi is nominated for best actress in a mini-series for Cranford and is pitched against fellow Briton Dame Maggie Smith for Capturing Mary. Flying flag The equivalent category for an actor is also a battle of the Britons with nominees including Sir Ian McKellen and Michael Sheen. Sir Ian is up for The Prisoner while Sheen is nominated for his role as Tony Blair in The Special Relationship, penned by The Queen and Frost/Nixon screenwriter Peter Morgan, who is recognised in the mini-series writing category. Morgan's drama is also in the running for best TV movie. Dame Judi's Cranford co-star Jonathan Pryce, meanwhile, is up for best supporting actor in a mini-series. Period drama Mad Men has 17 nominations including for best drama series, a category which includes vampire show True Blood and Lost, which ended this year after six seasons. Lost star Matthew Fox is nominated for best actor in a drama against fellow contenders including Hugh Laurie for House. The British actor won the equivalent Golden Globe award in 2006 and 2007. Other actors flying the flag for the UK include Sir Patrick Stewart, for Hamlet, and Sir Michael Gambon, for BBC Jane Austen adaptation Emma - both up for best supporting actor in a mini-series. There were also nods for Jamie Oliver's Food Revolution for the reality award, Believe: The Eddie Izzard Story for non-fiction special, and cartoon podcast The Ricky Gervais Show for best animation."
uk-northern-ireland-17468152,Current A&E system 'intolerable',"The person leading an action group looking at reducing waiting times at emergency departments across Northern Ireland has said the current system is ""intolerable"".","By Marie-Louise ConnollyBBC Northern Ireland health correspondent Mary Hinds, director of nursing at the Public Health Agency, spent six weeks observing how the A&E service is run at the Antrim Area Hospital. Patients, staff and management were interviewed. Ms Hinds will submit her report to the health minister shortly. Speaking to the BBC, she said there needed to be a better management of patients. When asked if some patients are being managed in an environment which is not safe, she said: ""There should be the appropriate number of nurses to look after the patients. ""When admitted to hospital and you are delayed in the system, someone should be appointed to care for you. ""There should be someone responsible for you, for monitoring you, and caring for you."" Ms Hinds refused to comment on the care of the elderly man who died on a hospital trolley at the Royal Victoria Hospital after waiting almost 24 hours for a bed. It was revealed last week that the man had died unnoticed in the accident and emergency department on Tuesday 6 March. However, Ms Hinds clearly laid out what should be in place when a person is admitted to an emergency department. ""It is our responsibility to try and fix it,"" she said. ""Even today I have challenged nurses to try and speak with courage to help fix their services every single day they go into work. ""For the very first time we've now got a commitment from the department to support normal ranges of staffing levels for nursing and that is a first. ""That will ensure safe staffing levels across our trusts in Northern Ireland. Speaking after a speech from Health Minister Edwin Poots to over a hundred nurses, where he outlined his plans to address the A&E crisis, Ms Hinds said he had shown ""great courage"". ""The Minister is showing real leadership,"" she said. ""He is showing that he's making it a priority, he is showing that patients being delayed in A&E is unacceptable. ""I think there is a bringing together of energy and I hope this new action group which has been formed will make the difference. "" After their time spent at the Royal Victoria Hospital's A&E department, it is expected that the team will observe the Ulster Hospital's emergency area in the South Eastern Health Trust."
technology-41928147,Code bug freezes $150m of Ethereum crypto-cash,More than $150m (£115m) of a crypto-currency called Ethereum may have been permanently frozen after a code bug was accidentally triggered.,"The bug was in code written by Parity Technologies to create digital wallets holding virtual coins - called Ether. It let someone hunting for bugs become the joint owner of hundreds of wallets. However, when the unidentified person tried to reverse their mistake they stopped the original owners of the wallets getting access too. Find and fix In a statement, Parity Technologies said all wallets created after 20 July this year were affected by the mistake. It provided a link to a separate page on which Ether holders could check to see if their wallet was among this vulnerable batch. Parity expressed regret over the ""great deal of stress and confusion"" the incident had caused. It added: ""We continue to investigate the situation and are exploring all possible implications and solutions."" It is not yet clear whether Parity will be able to rectify the mistake. This is because the unidentified person who triggered the problem used a function that ""suicided"" code that could have been used to resurrect the wallets. Estimates of exactly how much of Ethereum's coins has been frozen vary widely. Low estimates put the figure at $150m but others suggest it could be as high as $300m. The bug was triggered while an unnamed developer was looking through the Parity code for ways that it could be exploited. Only wallets created after 20 July are affected because they use an updated version of Parity's wallet program issued to fix another bug that led to $30m of Ethereum coins being stolen. Ethereum is a crypto-currency similar to Bitcoin that uses a large network of computers to verify transactions and generate new coins. Currently, one Ether digital coin is worth about $314."
uk-scotland-highlands-islands-26436060,Hushabye mountain: Ski resort may offer sleepovers,A snowsports centre has started looking at the potential of offering overnight accommodation to its visitors.,"Nevis Range and the University of the Highlands and Islands' Centre for Recreation and Tourism have launched a survey to gauge interest in the plan. People have been asked if they would stay in dormitories, chalets or luxury-style accommodation. The survey also asks how much visitors would be willing to pay and how long they would stay. Nevis Range had its busiest day for 10 years on 16 February when almost 1,700 skiers and snowboarders took to the slopes. The resort was not able to operate all of its lifts because some were still buried under unprecedented amounts of snow. Glencoe Mountain, another of Scotland's five outdoor ski centres, already offers holiday accommodation called Hobbit Houses."
business-24194726,Greece resumes talks with creditors as strikes planned,The so-called troika of lenders has returned to Athens for its latest audit of the Greek economy.,"The visit will determine whether twice bailed-out Greece will get its latest instalment of cash. Representatives from the European Commission, the International Monetary Fund and the European Central Bank will take stock of how effective tough austerity measures have been. Fresh strikes are planned by public sector workers in response. 'Struggle' Sunday's talks will decide on the continued conditions for Greece's financial aid, and a 1bn euro (£844m) instalment which Greece expected to get in October. The EU is calling for the liquidation of Greece's defence industry, a further reduction in civil servant posts, and the health of the key privatisation programme. The main public sector union Adedy said that it would carry out a two day strike on Tuesday and Wednesday, while other unions are following suit. ""We will continue our struggle against the destructive policies of the government and the troika,"" Adedy said in a statement. This latest round of protests against austerity comes days after the Greek Finance Minister Yannis Stournaras said his country's economy is heading ""slowly towards recovery"" after it saw growth in the second quarter of the year. Mr Stournaras said available evidence suggested Greece will see quarter-on-quarter growth for the first time since its economic crisis began. Greece also reported slightly improved jobless figures for the summer period, as tourism saw a modest boost compared to the year before."
uk-england-somerset-45220825,Somerset lost gold ring found on carrot dug up for dinner,A gold ring that was lost in a vegetable garden 12 years ago has been found on a carrot dug up for dinner.,"Lin Keitch, 69, from Monkton Heathfield near Taunton, Somerset, noticed it while washing her home-grown vegetables. It had been a 40th birthday present from her husband Dave, and was lost by their daughter. The couple believe the carrot grew through the ring. Ms Keitch said it was a ""chance in a million"" discovery. ""Dave dug up the carrots and left them outside the back door,"" she said. ""I cut the greens off and scrubbed them, and I thought, 'What's that? Goodness, it's my ring'."" She said even though the ring, with an amethyst stone in the centre, was covered in earth she recognised it immediately. ""Dave had bought it for me for my 40th birthday, but when it got too small for me I gave it to our daughter. ""She lost it up the garden - it must be at least 12 years ago. I thought I'd never see it again. ""I'm amazed the carrot grew through it."" You may also be interested in: Dave Keitch, 69, said he had looked for the ring regularly over the years ""every time I do the garden over"". He did not realise he had dug it up with the carrots last week. ""When Lin put it in the bowl to prepare them for dinner she noticed it on the end of the carrot. She was over the moon. ""She doesn't know whether to give it back to the daughter in case she loses it again, or keep it herself."""
world-us-canada-37198235,Ex-PM Stephen Harper quits Canada politics,"Former Prime Minister Stephen Harper has given up his seat as an MP, leaving Canadian politics after more than 20 years to focus on his businesses.","The news comes 10 months after Mr Harper lost the election to Justin Trudeau and then resigned as Conservative leader. He said representing Calgary in Parliament had been an honour. He was first elected as a Reform MP in 1993 and later led the Conservative Party to three election victories. In a written statement, he said: ""Friends, we did a lot together, but I know the best is yet to come. ""Our country must continue to serve as a model of prosperity and freedom."" Three election wins, no shortage of controversy Five things Stephen Harper got wrong He listed his achievements as cutting taxes and balancing the national budget. ""We got tough on crime and put families first. We managed our G7 economy through the worst global recession since the Great Depression, and came out in the strongest position of them all."" He said he was preparing for ""the next chapter"" of his life. According to Bloomberg, the 57-year-old will work on his consulting, with the intention of launching a firm in Calgary which will focus on international issues."
uk-wales-south-east-wales-36478937,Cardiff University race equality review after play concerns,Cardiff University has launched a racial equality review amid reports face paint was used to impersonate a staff member in a student-led play.,"Vice-Chancellor Prof Colin Riordan said he was keen for the whole university to ""learn lessons from the review"". It will focus on the School of Medicine and look at concerns raised about the play, Anaphylaxis, the university said. The independent panel will begin work over the summer and report back in the autumn. The university said it will also look at other related student societies and practices at its medical school to ""assess their impact on minority ethnic students and staff"". 'Committed' Prof Riordan said: ""Cardiff University needs to be a place where all our students and staff can thrive irrespective of their background and the review is part of our pro-active approach to ensuring this. ""Cardiff University takes issues relating to equality and diversity very seriously and is committed to supporting, developing and promoting equality and diversity in all of our activities."" Prof Dinesh Bhugra, professor of mental health and diversity from the Institute of Psychiatry at King's College London, will lead the review with two independent panel members, yet to be appointed."
entertainment-arts-45395322,Chris Evans: A life in broadcasting,Chris Evans has announced he will be leaving the Radio 2 breakfast show at the end of the year to host Virgin Radio's equivalent.,"His departure will bring an end to the latest chapter in an eventful career that has brought him fame, riches - and some notoriety. Evans built his reputation as a witty prankster on London station GLR, where he started as a producer and ended up as a star DJ. He shot to fame in 1992 as host of The Big Breakfast, a riotous early morning programme on Channel 4. The Big Breakfast was a huge hit in its early days, beating even GMTV when it launched on ITV in 1993. The Warrington-born star's dynamic personality defined the show, which catapulted him from cult personality to national celebrity. Don't Forget Your Toothbrush, his first prime-time TV show, made its debut on Channel 4 in 1994. The format for the show - made by Ginger Productions, his own production outfit - was lucratively sold around the world. After leaving The Big Breakfast in 1994, Evans was recruited by BBC Radio 1 to revamp the station's breakfast show. He accepted on the proviso it would be in the hands of Ginger Productions, an arrangement the BBC was prepared to accept in return for bumper ratings. In 1996 he returned to Channel 4 to launch TFI Friday, a classic Evans cocktail of live music, celebrity chat, outlandish stunts and in-jokes. Yet he found it hard to juggle it with his Radio 1 day job, leading to a parting of the ways in January 1997 when his demands to work a four-day week were refused. ""I was stupid, no doubt about that,"" he admitted in 2009. ""I was ungrateful. I had this brilliant career and messed it up."" Evans was not off air for long. Later that year he returned to breakfast radio, on Sir Richard Branson's Virgin station. He liked the job so much he bought Virgin Radio from Sir Richard at the end of 1997. But the Evans magic started to fade soon afterwards. He was photographed out on the town with Paul Gascoigne, damaging the footballer's chances of getting into the England squad for the 1998 World Cup. TFI Friday started to go off the boil, while two BBC projects, the National Lottery-based Red Alert and student quiz Carry On Campus, flopped. That did not stop him selling his Ginger Media Group to the Scottish Media Group (SMG) for £225 million in early 2000. Yet things soon turned sour at Virgin. Evans failed to turn up for a week of breakfast shows and the station ignored his claim that he had been ill. Photographs and footage had emerged of him out drinking with pop star Billie Piper, prompting Virgin to dismiss him. Evans said the termination of his contract cost him £3 million in lost share pay-outs. Yet he ultimately lost his case against his former station. He and Piper married in 2001 and moved to Los Angeles. But their union did not last and they divorced in 2007. Evans would eventually return to the BBC in 2005 to present afternoon shows on Radio 2. After moving to Drivetime in 2006, he was named as Sir Terry Wogan's successor in the coveted breakfast slot in 2009. The following year he moved back to prime-time television by co-presenting BBC One's The One Show on Friday evenings. Evans went on to become one of the BBC's top earners, with figures last year revealing he brought in between £2.2m and £2.25m. This was partly due to him co-hosting BBC One's Top Gear following the departure of Jeremy Clarkson, Richard Hammond and James May. Evans, a well-known petrolhead and experienced broadcaster, was seen as a safe bet to take over the helm of the BBC's flagship motoring show. Yet ratings plummeted, and the presenter was forced to apologise for an ill-advised stunt filmed around a monument to Britain's war dead. Evans left Top Gear after one series, concentrating instead on his Radio 2 show and his two children with third wife Natasha Shishmanian. One of the show's most popular initiatives is 500 Words, a story-writing competition for children now in its eighth year. Earlier this year Evans revealed that he and Natasha, a professional golfer and columnist, were expecting twins. Speculation is mounting over who will replace him now he has chosen to bring the curtain down on his 13 years at Radio 2. Follow us on Facebook, on Twitter @BBCNewsEnts, or on Instagram at bbcnewsents. If you have a story suggestion email entertainment.news@bbc.co.uk."
