id,headline,subheading,body
uk-56794047,Covid: More than 10m people fully vaccinated in UK,"More than 10 million people in the UK have received a second dose of a Covid-19 vaccine, according to the latest government figures.","It means more than 19% of UK adults are now fully vaccinated, while nearly 33 million people have had their first dose. Prime Minister Boris Johnson described the news as a ""remarkable milestone"". Also hailing the ""terrific milestone"", the health secretary urged people to get the jab ""as soon as possible"". ""Second doses are crucial to maximising the strength and duration of your protection from Covid-19,"" he added. Sir Simon Stevens, chief executive of NHS England, said: ""The success of the NHS vaccination programme is not a happy accident. It is down to careful planning coupled with the sheer hard work and determination of doctors, nurses and countless other staff ably assisted by volunteers and many others."" It comes as the UK recorded four deaths within 28 days of a positive test - the lowest daily figure since 7 September, although the number of deaths recorded on Mondays and over the weekend tend to be lower because of reporting delays. There were also 2,963 new cases, according to the latest government figures. Mr Hancock told the Commons the government was ""on track"" to offer a first dose to all adults in the UK by the end of July and uptake had been ""astonishingly high"", at 94% for over-50s. However, he said the vaccination rate for care home staff was currently below 80% in more than half of all local authority areas. As a result, he said, the government had launched a consultation into whether care home providers for older adults should only deploy workers who have received their Covid jab, unless they have a medical exemption. People aged 45 and over are now being offered the vaccine in England and Scotland. In some areas of Wales 40-49 year-olds are being invited, while in Northern Ireland vaccine appointments are now being made available to a limited number of 35-39 year olds. The rollout will continue to prioritise groups by age, according to advice from the Joint Committee of Vaccination and Immunisation (JCVI). The 10 million mark for second doses is a great milestone. But the rapid acceleration in second doses has come at a cost to first doses - and this spells trouble for the government's ambition to offer every adult in the UK a jab by the end of July. Currently the UK is doing just over 100,000 first doses a day on average, that is down from 500,000 a month ago. There was always going to be some drop-off. But on that trajectory just over half of under-50s will get a first dose by the end of July. Take-up is predicted to be lower in the younger age groups than it has been in the older ones so that shortfall may not be as bad as it first looks. What is more, there is the hope vaccine supplies will increase. More doses of Moderna may become available, while there is hope the Novavax jab, which is being made in the UK, could come into play in May. Nonetheless, it is another reminder that the vaccine programme still has many hurdles to cross. It comes after the government said all over-50s and those in high-risk groups in the UK had been offered a first dose. Earlier this month the UK began to roll out the Moderna vaccine, alongside the Oxford-AstraZeneca and Pfizer-BioNTech jabs. All under-30s in the UK will be offered an alternative to the AstraZeneca jab due to evidence linking it to rare blood clots. Meanwhile, Mr Hancock announced that India would be added to the travel red list from 04:00 BST on Friday. It means anybody who is not a UK or Irish resident or British citizen cannot enter the UK if they have been in India in the last 10 days and any other arrivals will need to quarantine in a hotel for 10 days. Earlier, the prime minister cancelled a trip to India, which had been due to take place on 26 April, amid rising cases there. Health officials in the UK are investigating whether a variant first found in India spreads more easily or is resistant to treatments or vaccines. Mr Hancock said there had now been 103 cases of this variant detected in the UK, with the vast majority linked to international travel. He said there had also been 557 cases of the variant first found in South Africa detected in the UK since December. The health secretary said the government was ""ramping up"" plans for a booster shot to ensure vaccines stayed ""ahead of the virus"". ""We will be working with our current vaccine suppliers and new suppliers, like the CureVac partnership, to work out which vaccines will be effective as a booster shot and to design new vaccines specifically targeted at the variants of concern,"" he added."
uk-scotland-north-east-orkney-shetland-11635750,'No decision' taken over Moray RAF base futures,The Scottish Secretary has insisted that no final decisions have been taken on the future of RAF bases in Moray.,"RAF Kinloss is set to effectively close after the order for new Nimrods was cancelled, and there are growing fears for the future of RAF Lossiemouth. It is thought Lossiemouth could lose its Tornado fleet to RAF Marham. Michael Moore, speaking in the Commons, promised help would be provided to the local area but insisted no final decision had been made. Later, during Prime Minister's Questions, David Cameron denied accusations of concentrating defence spending in the south of England. Meanwhile, First Minister Alex Salmond has written to Defence Secretary Liam Fox setting out concerns about the RAF bases in Moray. Mr Salmond said: ""I fully appreciate that tough decisions must be made in times of financial constraints. ""However these sorts of decisions must also be fair, balanced and responsive to wider long-term social and economic impacts, particularly where these cannot be absorbed easily within local communities."" It is feared the base's Tornado fleet could be transferred to RAF Marham in Norfolk, where engineering work for the aircraft is already based. It has been suggested RAF Kinloss could be retained as a barracks for soldiers returning from Germany. Defence sources have already said the troops would not arrive until about 2015 at the earliest. Moray's two RAF bases contribute more than £150m to the local economy annually and support about 5,700 jobs, a report said earlier this year."
uk-england-kent-56180461,Channel crossings: Migrant boats with 77 people on board intercepted,Four boats with 77 people on board have been intercepted as they crossed the English Channel.,"The Home Office said the incidents took place on Tuesday, with the French authorities not reporting any interceptions in their waters. According to Home Office figures, more than 400 people have made the crossing in small boats so far this year. On Monday, 49 people in four boats made the journey across the Channel. 'False dreams' The UK government said it continued to undertake ""substantial measures"" to stop criminals exploiting migrants for profit and selling ""false dreams of life in the UK"". A Home Office spokesperson said: ""Since the start of the year, through the joint operational and intelligence deployment shared by our two countries, the French authorities have prevented 70 per cent of attempted Channel crossings. ""In January we introduced new rules which mean we can treat asylum claims as inadmissible if they have travelled through safe countries to get to the UK."" More than 8,438 people crossed the English Channel in about 635 boats in 2020. Tuesday's tally was the second highest daily total this year since 10 January, when 103 people crossed in six boats. Follow BBC South East on Facebook, on Twitter, and on Instagram. Send your story ideas to southeasttoday@bbc.co.uk. Related Internet Links UK Home Office"
world-australia-50055277,African swine fever: Australia expels Vietnamese woman over pork haul,Australian authorities have expelled a Vietnamese woman after officials found 10kg of undeclared food in her luggage.,"The 45-year-old arrived at Sydney airport on Saturday with raw pork, quail, pate, squid and other food items, officials said. It is the first time Australia has cancelled a visa over food under strict new bio-security laws aimed at keeping African swine fever out of the country. The contagious disease has decimated pig numbers across Asia and Europe. ""In the midst of what is potentially the biggest animal disease event the world has seen, it beggars belief that someone would deliberately attempt to bring pork meat past our border,"" Agriculture Minister Bridget McKenzie said in a statement. Under an amendment to Australia's Migration Act passed in April, visitor visas can be shortened or cancelled for bio-security contraventions. On-the-spot fines can also be given to offenders, but authorities said that - given the scale of her offence - the unnamed woman was sent back to Vietnam instead and is banned from visiting Australia for three years. Pork is big business in Australia - official figures estimate that the country's pork industry is worth more than five billion Australian dollars ($3.4bn; £2.6bn). Australian bio-security agencies have stepped up screening efforts at airports and mail distributors in an effort to contain African swine fever. Concerns were raised after the disease was detected last month in East Timor, one of Australia's closest neighbours. Ms McKenzie said that 27 tonnes of pork products have been seized at Australia's borders since February. The minister noted a ""concerning"" increase in the number of these products contaminated with ASF, saying contamination rates jumped from 15% in February to 48% in September. ""That is why, if you are travelling from an African swine flu affected country, we are watching you,"" said Ms McKenzie. Countries across Asia have been struggling to contain the spread of ASF, an incurable condition that is not dangerous to humans but is fatal to pigs. The disease has a mortality rate of up to 100%, according to the UN. It emerged in East Africa in the early 1990s, moved through sub-Saharan Africa, and has also been recorded in Europe. China - which has half the world's pigs, and where pork is often a staple food - confirmed an outbreak last August. Since then, more than one million pigs have been culled in China, and over five million in Vietnam. In South Korea hundreds of soldiers and civilian hunters have been deployed along the country's border with North Korea to kill wild boars and feral pigs to stop the spread of the disease."
uk-30287880,"Murders linked to probation changes, says Napo","Changes to the way offenders are supervised in England and Wales may have contributed to two murders, says the probation officers' union.","The union said that in one case a man who killed his partner then himself had been under the supervision of an ""overworked"" trainee officer. It urged the government to halt the changes, which involve contracting out the monitoring of some offenders. The Ministry of Justice said it would ""robustly"" contest the allegations. Appearing before the justice select committee on Tuesday, Justice Secretary Chris Grayling questioned the claims made by the National Association of Probation Officers (Napo). He said: ""The trade union has, on occasion, put forward information and have not given full context or accuracy of the situation. ""However it is really important to be clear that the number of serious further offences since the reforms began in June is lower than it was."" Safety 'risk' As part of the changes, offender management was split between different agencies six months ago. By early next year, private firms and voluntary groups will be responsible for the supervision of 200,000 low and medium risk offenders. These organisations are called ""Community Rehabilitation Companies"" - or CRCs - and the contracts are worth about £450m a year over seven years. But Napo argues that move as well as staff shortages are putting public safety at risk. It is also concerned because staff working for the CRCs do not have full access to offenders' records and are therefore unable to accurately assess the risk they pose. This is because of the data protection laws and protocols around private companies being allowed to look at the databases of the National Probation Service (NPS). In an 18-page letter to Justice Secretary Chris Grayling, the union highlights a recent case of one offender ""with a history of domestic violence"" who went on to murder his partner before taking his own life. It claims the trainee allocated to undertake home visits to the man was ""too overworked"" to visit every four months as required. Another probation officer was ""unable to spend sufficient time working with an offender"", the letter alleges, because of an ""excessive caseload"". ""Left without suitable supervision, the offender committed a murder while under supervision of the CRC,"" it added. 'Immature' The union highlighted a case in which a probation officer was sexually assaulted on a visit, and said that ""defects in the ICT system"" prevented her seeing a ""risk flag that the offender should not be seen alone by female officers"". In his letter, Napo general secretary Ian Lawrence said the union did not believe the MoJ had enough evidence ""to show that it is safe to proceed"" with the transfer of shares in the CRCs to the winning bidders. When talking specifically about Mr Grayling he said: ""Here's a minister that not only sits on information that's vital to the public interest, he refuses to engage directly with Napo on the basis that he says our campaign is immature. ""I don't think it's immature when we are highlighting key issues of public safety, serious further offences, a risk to our staff, and a risk to communities at large."" But a Ministry of Justice spokeswoman said the department had tested its changes to the system at ""every stage"". ""We will be robustly defending the allegations made by Napo and expect new providers to be in place and delivering services by early 2015,"" the spokeswoman added. ""Reoffending rates have been too high for too long, and we must act now to turn the tide on this unacceptable problem. ""It would be inappropriate to comment further while legal proceedings are ongoing."""
world-europe-31930414,Joe Biden makes 'orange' joke while greeting Enda Kenny,"The US Vice-President has joked with the Taoiseach (Irish prime minister) Enda Kenny that ""if you're wearing orange, you're not welcome in here"".","Joe Biden made the joke when he met Mr Kenny for a breakfast meeting at his home in Washington on Tuesday. The vice-president later added that he was ""only joking"". However, the Democratic Unionist Party described the remarks as ""disgraceful and careless"" and has called on Mr Biden to apologise. 'Slur' DUP representative William McCrea, who is the MP for South Antrim, said he appreciated that Mr Biden said it was a joke, but added he did not view the comments as humorous. ""When Northern Ireland is making such an effort to make St Patrick's Day an inclusive celebration, Joe Biden's comments were disgraceful and careless,"" Mr McCrea said. ""Whether they were intended as a joke or not, the comments are a slur on those who would be known as 'orange' - i.e. Protestants. ""This term is much wider than anyone who is a member of the Orange Order. It has traditionally been used to define people from the Protestant faith. The DUP MP said Mr Biden should ""apologise for his remarks and take corrective action to prove in a practical way that people who are from a Protestant background are welcome in the White House"". ""Undoubtedly if he had made such a remark about any other faith group there would be calls for his resignation,"" Mr McCrea added. Mr Kenny is on a five-day visit to the United States. His meeting with Mr Biden came ahead of a bilateral meeting with President Barack Obama."
uk-england-beds-bucks-herts-44383189,HMP Woodhill prisoner death: Three held in murder probe,"A inmate has died after an ""altercation"" involving four men at a prison.","Thames Valley Police said the 49-year-old was pronounced dead at HMP Woodhill in Milton Keynes on Tuesday afternoon. Three men, aged 33, 32 and 26, have been arrested on suspicion of murder, police said. HMP Woodhill is a Category A prison that currently houses about 800 inmates. ""An HMP Woodhill prisoner was pronounced dead following an incident on Tuesday 5 June,"" a Prison Service spokeswoman said. ""It would inappropriate to comment further while there is an ongoing police investigation."" Det Ch Insp Ailsa Kent said: ""We have launched an investigation into this incident, and are working alongside the Prison Service. ""Three arrests have been made as a result of the offence and these men are all in custody. ""The family of the victim is being supported by specially trained officers at this time. ""Our officers are at the scene as our investigation continues."""
entertainment-arts-56234629,In pictures: Golden Globes stars shine without red carpet,The 78th annual Golden Globe Awards for film and television have been handed out in a largely virtual ceremony split between Los Angeles and New York.,"Tina Fey and Amy Poehler - pictured above - hosted the event for a fourth time, but because of restrictions imposed by the pandemic, Fey broadcast from New York while Poehler was in LA. Chloé Zhao looked stunned when she was named by Michael Douglas and Catherine Zeta-Jones as best director for the movie Nomadland. Zhao is only the second female winner of that category in the awards' 78-year history. Nomadland also took the coveted award for best drama film. The prizes were announced by a host of stars, including British actress Cynthia Erivo who wore a neon green dress. Jackson Lee and Satchel Lee - the children of film director Spike Lee - were also among the presenters, as was Israeli Wonder Woman actress Gal Gadot. Veteran Hollywood star Jane Fonda, 83, received the Cecil B DeMille Award for lifetime achievement. She used her acceptance speech to call for greater diversity in the industry, saying that storytelling ""really can change people"". British actor John Boyega gave a double thumbs up after winning the best supporting actor award for Small Axe. Emma Corrin won best performance by an actress in a drama series for her role as Princess Diana in The Crown. ."
business-21762247,"France to miss deficit target, President Hollande says",President Francois Hollande has admitted France will miss its target on lowering the budget deficit this year.,"France's deficit will ""without a doubt"" be 3.7% of its output this year, he said, above the 3% he promised to cut it to during the election last year. The 3% deficit target is also one set by the European Union - but most of the major euro nations are in breach. The news comes as France's economic progress was criticised by a European Central Bank board member. ""The reform course in France seems to have floundered,"" Germany's Jens Weidmann said. ""The crisis that we are facing is a crisis of confidence, and this confidence cannot be gained if we postpone the tackling of the root causes of the crisis,"" Mr Weidmann said, referring to France, Italy and Cyprus as countries that still face tough financial situations. Greece, Ireland and Portugal have been effectively shut out of borrowing long term on international financial markets, which forced them to seek help from European partners and the International Monetary Fund. They all adopted austerity policies to cut public spending, but France has bucked the trend, raising taxes instead to protect its social model. During the election last year, Mr Hollande vowed to bring the deficit to 3% from its current 4.5% and had insisted this was possible until now admitting defeat. But he defended his record, saying that the deficit has come down from more than 5% in 2011. ""In two years, we have performed a structural recovery,"" the president said on Tuesday, that ""is as unprecedented as it is significant"". ""Addressing our accounts is a financial obligation... but it is also an obligation of sovereignty because France must never be in difficulty in the markets."" The ECB's other German board member, Joerg Asmussen, last month urged France to take ""concrete and measurable"" steps to bring down its budget deficit. The number of jobless in France has now risen past 3 million."
uk-northern-ireland-50063444,Brexit: DUP says 'gaps remain' after Johnson meeting,The Democratic Unionist Party (DUP) has said further work is required before it will back any fresh Brexit agreement.,"Members of the party met Prime Minister Boris Johnson for the second night in a row amid speculation a deal is close. Earlier, party leader Arlene Foster said the DUP would ""stick with our principles"" that NI ""must remain"" in the United Kingdom's customs union. It comes after the Guardian said the UK has made further concessions over the issue of customs and the Irish border. Downing Street has played down reports of an imminent deal with the EU. In a statement following the 90-minute meeting, the DUP said: ""We respect the fact negotiations are ongoing therefore cannot give a detailed commentary but it would be fair to indicate gaps remain and further work is required."" The DUP has consistently opposed any new customs checks between Northern Ireland and the rest of the United Kingdom, while the EU and the British government have both said there cannot be a hard border within the island of Ireland. Asked earlier if the DUP had given any ground on customs checks, Mrs Foster told BBC News NI: ""We are in a negotiation. I think it is right to give the negotiators space and time to do all of this. ""Everybody knows what our position is in relation to the constitutional and economic integrity of the UK. ""That is where we stand, we continue to stand there."" She added that the DUP had always said Northern Ireland must be ""integrally within the UK"" and dismissed some speculation around a Brexit deal as ""so far off of the mark you can't see the mark anymore"". On Tuesday, EU negotiator Michel Barnier said there was a ""narrow path"" to a Brexit deal this week but the two sides would have to agree the details by the end of the day. Taoiseach (Irish Prime Minister) Leo Varadkar said talks were ""moving in the right direction"" but gaps between the sides remained. The UK is due to leave the EU at 23:00 GMT on 31 October. Mr Barnier said there was a ""narrow path"" to be trod between the EU's objective of protecting the single market and Boris Johnson's goal of keeping Northern Ireland in the UK's customs territory. The original Brexit deal struck between the EU and former Prime Minister Theresa May contained a clause known as the backstop, which would have seen the whole of the UK staying in the customs union for an indefinite period. The DUP also opposed an earlier proposal from the EU that would have involved Northern Ireland alone remaining in the EU's customs union. Mrs Foster said there was ""no point reinventing that"" and called for flexibility from the EU."
uk-england-dorset-20962034,Landslip fears close Portland's Tout to Blacknor coast path,"A section of coastal path in Dorset has been temporarily closed owing to the threat of landslides, following recent heavy rainfall.","Dorset County Council said there was ""evidence of substantial landslide movement"" on the path between Tout and Blacknor on Portland. The authority also reported rock fall on slopes below the bridge north of Blacknor. The path will be diverted further inland from Friday. 'Extreme rainfall' The decision follows a number of landslips and mudslides in the county, including one in Lyme Regis in December which left a beach chalet dangling over the edge of a cliff. A spokesperson for the council's coastal rangers team said: ""Experience has shown that these landslides can be slow and progressive but quite clearly they could also collapse quickly and unexpectedly, especially after such extreme rainfall."" Charlotte Blackman, 22, from Heanor, Derbyshire died on 24 July after the 160ft (49m) high cliff above her collapsed onto Hive Beach near Burton Bradstock. Five people escaped unhurt after a landslide on 8 August between Charmouth and Golden Cap. The county council said the path between Tout and Blacknor would be closed for ""the next few months"", while monitoring and repairs are carried out. The coast path between Burton Freshwater and Hive Beach is also currently closed and being diverted inland."
