id,headline,subheading,body
uk-scotland-edinburgh-east-fife-26272755,Edinburgh trams: £1m campaign to bring people back to city centre,A £1m campaign has been launched aimed at attracting families and shoppers back into Edinburgh city centre following an end to the tram works.,"Officials hope the move will stimulate an additional £50m spend in the city centre over the next two years. The campaign follows a survey of 2,000 residents, in which 92% said they felt the tram works had affected their enjoyment of the city centre. Almost 30% said they shopped there less than they did a couple of years ago. However, 87% of the people questioned said they were now open to coming back into the city centre more often. Officials said the campaign was targeted at residents of Edinburgh and people who lived within a two-hour drive of the city. The campaign, called This is Edinburgh, aims to increase footfall to the centre by 2% above the national average. Hidden gems Andrew Burns, Edinburgh City Council's leader, said: ""Edinburgh is a unique and world class place but we recognise that some folk may be out of the habit of coming into town. ""This campaign lets the city speak for itself, reminding people of the fantastic and diverse proposition that the city centre has to offer."" John Donnelly, Marketing Edinburgh chief executive, said: ""When we set out to create the campaign, we spoke with lots of different groups, listening to their opinions on Edinburgh. ""Overwhelmingly, our research found that residents had become very resistant and unresponsive to what they see as adverts of Edinburgh for the tourists. ""What did excite them however was the idea of rediscovering their city, finding its hidden gems and engaging residents in that conversation through social media."" This Is Edinburgh advertising was created by Edinburgh-based agency, The Lane. The first TV advert will air on Monday at 19:45 on STV."
uk-england-hampshire-56992734,"West End hive vandals kill thousands of bees, says keeper","Thousands of honeybees were killed when vandals broke apart a hive and sprayed it with paint, a beekeeper has said.","Peter Clark, 67, said he found the survivors sheltering from the cold and rain under the broken boards in West End, Hampshire, on Monday. He said a fifth of his bees died before he was able to repair the hive. Police asked for information about three boys seen in the area at about 18:30 BST, described as white, aged about 15-17 and wearing dark clothes. Mr Clark said security guards chased the teenagers from the hive on the Ageas Bowl Golf Course before losing sight of them in woods. He said he arrived later to find the bees ""huddling together in the pouring rain and keeping warm under the boards"". Part of the hive had been sprayed with yellow paint and large tree branches, clods of earth and bottles were found in the debris, he said. Mr Clark, of West End, said: ""It's just mindless vandalism. They clearly don't know the bees benefit everybody. ""There could have been anything up to 40,000 bees in there. Thousands have died."" Posting a picture of the damaged hive on social media, he said: ""If any of your kids came home yesterday covered in mud and wet with bee stings you know what they were doing."" Follow BBC South on Facebook, Twitter, or Instagram. Send your story ideas to south.newsonline@bbc.co.uk. Related Internet Links Hampshire Constabulary"
uk-england-leicestershire-39172426,Joe Orton play opens in Leicester to mark 50th anniversary of his death,"The sister of playwright Joe Orton says he ""would have loved"" having one of his most famous plays staged in his hometown 50 years after he died.","Orton from Leicester was murdered in 1967 by his partner Kenneth Halliwell. What the Butler Saw was written the year he died and challenged people's attitudes towards homosexuality, at a time when it was still illegal. Now open at the Curve Theatre, Leonie Orton-Barnett said his plays were still important today. ""He would have loved this,"" she said. ""He came home to Leicester a lot to visit family and touch base with people. ""He drew a lot of his material from being around working class people, seeing how they lived and talked to one another."" The play has previously been performed in London and Manchester. Artistic director at the Curve Theatre, Nikolai Foster, said: ""He was a working class kid from Leicester who helped change the course of British theatre so it is really significant we are stage here and on the 50th anniversary of his death. ""Orton's work was ahead of his time and it's still ahead of its time now."" The latest production stars actor and comedian Rufus Hound in the lead role of Dr. Prentice. It runs until 18 March."
entertainment-arts-52796215,The Archers returns with a lockdown twist,"The Archers returned to BBC Radio 4 on Monday, with a ""new style"" forced upon the show by the coronavirus lockdown.","Large cast recordings with interaction between multiple characters have been scrapped in favour of monologues recorded at the actors' homes. ""It might take a few episodes for listeners to get used to the new style,"" said Charlotte Martin, who plays busybody Susan Carter. ""It will be different [but] I think it will be enjoyable,"" she said. The rural drama resumed after a three-week break in which classic episodes kept listeners in touch with the residents of Ambridge. The first voice to be heard in the ""lockdown era"" was Tim Bentinck, who plays David Archer. The actor said he was ""incredibly proud"" to be pioneering the new format. ""As from Monday, the story of the now-virus-hit Ambridge will be told from the minds of the village characters, in a way that has never been heard in all its sixty-nine years,"" he wrote on Twitter. For the first time, listeners will get to hear what the characters ""really think"", he continued. ""As actors, we're always after the sub-text - what we say is not necessarily what we mean. Now, what we think is not necessarily what we say!"" Although the characters will be subject to the same restrictions as the rest of the UK, the plot won't focus solely on coronavirus - with upcoming episodes featuring storylines about Tracy and Harrison competing to become captain of the village cricket team, and a minor emergency caused by a broken down forage harvester. Last week, the series' editor Jeremy Howe revealed how coronavirus had thrown the soap's plans into disarray. ""We binned 12 scripts and five weeks' worth of storylines that were about to be written,"" he told Radio Times. ""We then started inventing stories that were set in Ambridge, where the coronavirus had now arrived, that could be told in a way that both reflected the lockdown and could be recorded in the cast's homes. ""I told the team - keep it simple."" For the actors, the lockdown meant recording their monologues at home in hastily-constructed makeshift studios. Annabelle Dowler, who plays Kirsty Miller, has been recording her scripts in her daughter's wardrobe, surrounded by duvets and and an old mattress to mask any external noises. On her Twitter account, she shared a photo of the notice she'd attached to the wardrobe door, warning her children to keep their distance. ""Stay away and be silent otherwise you will get into trouble with the BBC and we will have no iPlayer for the rest of the lockdown!"" Her co-star Charlotte Martin explained the challenges of recording in her bedroom. ""A studio is soundproof, whereas suddenly we were having to do it in our own homes,"" she said. ""I've got my two daughters home and making sure everything is quiet, that nobody is opening doors, that was tricky. I think my husband came up the stairs at one point and we had to redo that!"" She added that, as the crew adapt to new ways of recording the 69-year-old drama, they might be able to start incorporating more voices. ""There may be ways that we can get actors talking to each other or create ways in which we can interact with more than one character at a time, but that will be in the future."" In the meantime, the lockdown has provided one character with a lucky escape. Before the lockdown, Kirsty was due to marry handyman Philip Moss, who listeners recently discovered was an illegal gangmaster - employing slave labour in his building firm. For now, at least, those plans are on hold. Follow us on Facebook, or on Twitter @BBCNewsEnts. If you have a story suggestion email entertainment.news@bbc.co.uk."
uk-england-humber-39108243,More events announced for Hull's City of Culture year,A performance by the Royal Ballet will reopen Hull's New Theatre after a £16m refurbishment.,"The show in September is part of the next wave of events announced as part of the City of Culture year-long arts festival. Other highlights already announced include hosting the Turner Prize and an exhibition on poet Philip Larkin. Organisers said more than 42 works had been commissioned for the festival's spring and summer season. Other premieres include a new play by Hull author John Godber, as well as musical performances and the unveiling of artist Spencer Tunick's photographic work Sea of Hull, featuring 3,200 local people in the nude and painted blue. Pride in Hull Hull will also be at the forefront of national events to mark 50 years since the start of the decriminalisation of homosexuality. Pride in Hull is part of LGBT 50, and will celebrate the city's contribution to liberty, tolerance and emancipation around the world, organisers said. The event, which runs from 21 to 27 July, will feature Marc Almond, who had a hit with a cover of Gloria Jones' Tainted Love, with Soft Cell. 'Great for art' Hull's place as a major port, and its links with Rotterdam and Reykjavik, will also be celebrated under the theme of Roots and Routes, which runs from April to June. Martin Green, chief executive of the Hull 2017 organisers, said the summer events were a chance to ""throw the doors open"" to visitors to the city. ""We know that awareness of the project is really sky-high,"" he said. ""So now let's convert them into people who actually come to the city and that's great for art and great for the economy."""
entertainment-arts-20780645,Dominic West and Carly Bawden on song in My Fair Lady,"Actor Dominic West has earned glowing reviews for his stage musical debut in My Fair Lady - but the greatest praise was reserved for his co-star Carly Bawden, who plays Eliza Doolittle.","West is playing Professor Higgins in the show at the Sheffield Crucible. The Times said West ""can hold his own with the orchestra"" and The Telegraph judged him to be ""utterly persuasive"". But The Guardian declared it ""Bawden's show"", hailing the rising star's ""effortless and ecstatic"" singing. ""This Eliza means business,"" the Guardian's critic Lyn Gardner concluded. ""Luvverly."" Bawden plays the downtrodden Edwardian flower girl, whom a haughty phonetics professor attempts to pass off as an upper class lady. The Independent critic Jonathan Brown gave the show a five-star review and praised Bawden's ""brilliant all round portrayal"" of the street urchin-turned-society belle. ""Bawden's acting, her comic timing, singing, dancing and stage presence were all faultless and earned her - and her more famous main man - a joyous standing ovation on a buzzy, exciting night at the Crucible,"" he wrote. A five-star review by Daily Mail critic Quentin Letts concluded: ""Great show. A West End run must surely beckon."" West is ""not the world's greatest singer and oddly nervous last night"", Letts wrote, ""but he does radiate a dashing dastardliness"". Of Bawden, he declared hers a ""super performance"", adding: ""She has a sweet, strong singing voice and buckets of heart."" There were also plaudits for director Daniel Evans, with The Times critic Dominic Maxwell describing his production as ""quite a flat-out masterpiece"". The role of Eliza was first played by Julie Andrews on stage and was taken by Audrey Hepburn in the Oscar-winning 1964 film version. The last major UK revival opened in 2001 at the National Theatre in London, starring ex-EastEnders actress Martine McCutcheon."
uk-england-york-north-yorkshire-12532079,Harrogate police station construction work starts,The start of work on a new £18m police station in Harrogate has been marked by a turf-cutting ceremony.,"Chief constable Grahame Maxwell and North Yorkshire Police Authority chairman Jane Kenyon performed the ceremony at the Beckwith Knowle site. The station, due to open next spring, will replace the existing 1930s base in North Park Road in the town centre. A smaller office will be bought for the 30 officers and staff who make up the town centre Safer Neighbourhood Team. The Beckwith Knowle site will accommodate about 200 officers and staff, a 16-cell custody suite, two vehicle docks and a public reception area. It will be built by Surrey-based developer GB Building Solutions. Mr Maxwell said: ""I am delighted that we are starting the construction phase of this project, which will provide Harrogate with a 21st Century police station and will enable us to continue to provide a high-quality policing service to local communities in the years to come."" Ms Kenyon said: ""This really is a special day for the authority, force and the communities we serve, not just in Harrogate but across the whole county, who will benefit from this long overdue addition to the force's estate."""
world-europe-50955273,Russia-Poland row over start of WW2 escalates,"A row between Russia and EU countries over the causes of World War Two has escalated, with a top Russian official condemning the US ambassador to Poland.","Parliament Speaker Vyacheslav Volodin said a tweet by Ambassador Georgette Mosbacher was ""insulting"" to Russians and Americans. On Monday she tweeted: ""Dear President Putin, Hitler and Stalin colluded to start WWII."" President Vladimir Putin says Poland and its allies are distorting history. During a marathon news conference on 19 December, the Russian president said it was ""totally unacceptable and inaccurate"" to cast equal blame on Nazi leader Adolf Hitler and Soviet leader Joseph Stalin for the war's outbreak. Mr Putin said he had requested Soviet archive documents in order to write an article on the subject - Nazi Germany's invasion of Poland on 1 September 1939 - and, in his view, to set the record straight. He argued that the Western powers and Poland had appeased Hitler's aggression by letting him grab Czechoslovakia in 1938. The Nazi invasion of Poland came just a week after Hitler's Foreign Minister Joachim von Ribbentrop and Soviet Foreign Minister Vyacheslav Molotov had signed a non-aggression pact on 23 August 1939, which stunned the world. A secret clause in the pact carved up Eastern Europe into Nazi and Soviet spheres of influence, allowing the two dictators - one fascist, the other communist - to occupy and dismantle Poland. Ms Mosbacher's tweet recalled that Poland was a victim of the two dictators. But Mr Volodin, who is close to Mr Putin, said the US state department ought to make sure that an ambassador such as Ms Mosbacher had sufficient knowledge of a country's history before sending her to work there. Mr Putin has revived wartime Soviet symbols, and portraits of Stalin are commonly displayed in Russia now. In 2020, the 75th anniversary of the Allies' victory over Nazi Germany will be marked. More than 20 million Soviet citizens died in what Russians call the ""Great Patriotic War"" after the Nazis invaded the USSR in 1941. Mr Putin's father served in Stalin's NKVD secret police and was severely wounded in the war in 1942. President Putin argued that Stalin had tried to forge an anti-Hitler alliance with Britain, France and Poland, but that the Munich Agreement in 1938 - dooming Czechoslovakia - had scuppered that plan. Stalin then had to reach a deal with Hitler, feeling betrayed by the West, he argued. However, Western historians point out that the Nazi-Soviet Non-Aggression Pact meant Hitler did not have to fear a clash with the USSR if he invaded Poland, so giving him the assurance he needed. Moreover, Stalin then supplied the Nazi war machine with raw materials, which helped fuel - literally - Hitler's aggression against Western Europe. How has this row escalated? Monday, 30 December: Besides the tweet by the US ambassador, Germany's ambassador to Poland - Rolf Nikel - also wades into the row, tweeting: ""The Molotov-Ribbentrop Pact served to prepare the criminal invasion of Nazi Germany against Poland. The USSR together with Germany participated in this brutal division of Poland."" 29 December: Polish Prime Minister Mateusz Morawiecki issues a statement accusing Mr Putin of using the World War Two issue as a means to cover up recent international setbacks for Russia, such as the sports sanctions imposed over Russian doping. Mr Morawiecki says ""President Putin has lied about Poland on numerous occasions"". 27 December: Poland's foreign ministry summons the Russian ambassador to protest, recalling that the war began with the Nazi-Soviet pact, and that Poland lost about six million citizens in the war. Earlier, Mr Putin had scorned Poland and Western powers for appeasing Hitler and had labelled Poland's ambassador to Berlin in the 1930s an ""anti-Semitic swine"". 19 September: A European Parliament resolution - politically significant, but not a law - urges EU states to ""make a clear and principled assessment of the crimes and acts of aggression perpetrated by the totalitarian communist regimes and the Nazi regime"". It describes the war as ""an immediate result"" of the infamous Nazi-Soviet deal in 1939."
uk-england-derbyshire-27065392,Google to create virtual Peak District online,The Peak District will become the first UK National Park to have its trails and hard-to-reach locations captured on Google's Street View technology.,"Images will be recorded through Google Trekker equipment - backpacks fitted with a 15-angle-lens camera. The Peak District became the UK's first National Park 63 years ago. Google has marked the anniversary by posting an image of the Salt Cellar - an unusually shaped gritstone tor on Derwent Edge - on its front page. Peak District National Park chief executive Jim Dixon said: ""It is amazing to think that, thanks to technology, many more people will be able to enjoy the outstanding natural beauty of the Peak District. ""The Trekker will help bring the Peak District to life online and hopefully inspire families to come and enjoy a walk or a cycle ride in the most beautiful landscapes."" The Trekker equipment is designed to capture locations the Street View car and tricycle cannot reach. Previous locations captured by the technology include the Grand Canyon and the Taj Mahal. Peak District staff expect to start filming in May and June, and the images will appear on Google Maps in June or July. The locations to be captured will include all of the Peak District's traffic-free routes, including the Tissington, High Peak, Monsal and Thornhill trails. The views at Stanage Edge, where Kiera Knightley daydreamed of Mr Darcy in Pride and Prejudice, will also be stored. The Derwent Valley - where the World War Two Dambusters raid was rehearsed - will also feature."
uk-england-humber-12100830,North East Lincolnshire struggles to clear rubbish,"Bin collectors in North East Lincolnshire are struggling to clear a backlog of Christmas rubbish, the local council has said.","Not all of this week's scheduled waste and recycling collections had been completed by the end of Friday, North East Lincolnshire Council said. In a bid to clear the backlog, street cleaning staff will be diverted to waste removal duties on Sunday. Crews will be out on Monday ""to catch up on any outstanding collections"". A council spokesman said the problems had been caused by ""the large amounts of waste being put out to be collected"". Second setback By Tuesday, domestic waste crews will be working as listed in the council's Christmas card advertisement which was sent out to residents in the Grimsby, Cleethorpes and Immingham areas. However, street cleansing and grounds maintenance staff would still be diverted, if required, to ensure that any outstanding backlog of waste was collected, the council said. During those three days, the community recycling centre sites on Estuary Way, Grimsby and Queens Road, Immingham, will also be open between 0800 GMT and 1800 GMT. Residents who had not received a kerbside recycling collection by 1600 GMT on Friday 31 December should put out the waste from Tuesday 4 January and it would be cleared by Friday 7 January, the council added. It is the second time in a month that the council has had to deal with a significant backlog of waste. It was forced to suspend collections for two weeks just before Christmas as heavy snow and ice made driving conditions hazardous."
uk-wales-46126048,Outdated NHS Wales IT system 'needs a reboot',"Computer systems in the Welsh health service are ""outdated"" and failures are having a ""negative impact"" on patients, according to a new report.","By Geraint Thomas BBC Wales News An Assembly inquiry questioned the ""competence, capability and capacity"" of the body that looks after IT, the NHS Wales Informatics Service (NWIS). There were 21 systems outages in the first half of this year, according to the public accounts committee. The NWIS and Welsh Government said they would review the findings in detail. Committee chairman Nick Ramsay said the cross-party report had uncovered a ""raft of problems"" in the dysfunctional system. ""As we begin scrutinising one area, we find that other, equally serious questions arise elsewhere,"" the report said. ""As a consequence, we are anxious that our scrutiny has merely scratched the surface of NWIS' problems."" NWIS was established in 2010 to deliver technology and digital services for patient care in Wales. Establishing electronic patient records in Wales was one of its main projects. But the report said there were ""too many cases (where) the NHS relies on outdated, paper-based records"" when electronic records could lead to better patient care. The committee said they were ""particularly concerned"" to hear about the impact of outages on patient experience and staff morale at Cardiff's Velindre Hospital, although witnesses assured the committee no patients had come to harm during the IT failures. The cancer IT system, CaNISC, was highlighted as a particular problem, with the report stating committee members were ""alarmed"" by evidence Microsoft stopped providing support for the system in 2014 and it posed a cyber security risk. Richard Pugh, head of services at cancer charity Macmillan in Wales, said: ""Continuing with the current 'patch-and-mend' approach on an obsolete IT system will not only heap additional pressure on our hard-working cancer care workforce, it runs the risk of putting cancer patients in Wales at risk and creating unnecessary stress for those going through treatment."" However, AMs acknowledged ""funding is stretched"", with NWIS trying to keep its existing system going while under pressure to deliver new ones. The committee's inquiry followed a report by the Auditor General for Wales, published in January, which concluded that plans to digitise patients' NHS records in Wales face significant delays. Mr Ramsay added: ""Our inquiry has raised serious question marks about the competence, capability and capacity across the health system to deliver a digital transformation in Welsh healthcare. ""We trust our inquiry and this report will be a wake-up call to all those involved in harnessing the power of digital innovation to improve healthcare in Wales. We believe it's time for a reboot."" Recommendations include a call for a review of senior leadership capacity within both NWIS and the wider NHS digital team. GPs said the report had raised some ""alarming findings"" and data outages were becoming ""all too common"". Dr Peter Saul, of the Royal College of GPs in Wales, said: ""Today, IT systems are as critical to clinicians as stethoscopes and scanners. Data outages can be extraordinarily disruptive for practices and for patients. ""They affect appointments, prescriptions and the nuts and bolts of a functioning practice and can take hours to recover from."" The NWIS welcomed the report and said it had been ""pleased to share insight into the specification, planning, delivery and management of national digital health and care services for Wales"". The Welsh Government said it would provide a considered response in due course."
